"Id","IdString","Name","Lim","Rarity","Collection","Energy","Power","EffectDescription","EffectJSON"
"784","EMM010","Mary Queen of Scots","1","Epic","Unruly Rulers","4","43","When returned to your deck, all remaining cards in both players' hands cost 2 more Energy until the end of the Round.","NULL"
"785","EMM011","Nebuchadnezzar II","1","Cmmn","Unruly Rulers","2","17","When returned to your deck, Lock two Life on Land cards left in your opponent's hand next turn.","NULL"
"786","EMM015","Zhengde Emperor","1","Lgnd","Unruly Rulers","6","57","When returned to your deck, Lock all cards in your hand for the rest of the round and give them 25 Power until they are played.","NULL"
"787","EMM013","Peter the Great","1","Cmmn","Unruly Rulers","4","67","When drawn, BURN (10 P/T) a random card in your hand until it is played.","NULL"
"788","EMM007","Frederick William I","1","Cmmn","Unruly Rulers","1","9","When played, your cards with 40 or more Base Power have +22 Power this turn.","NULL"
"789","EMM019","Joanna of Castile","1","Lgnd","Unruly Rulers","6","45","When returned to your deck, if you're winning the round, gain +13 Power per turn for the rest of the game.","NULL"
"790","EMM016","Emperor Qianfei","1","Epic","Unruly Rulers","5","49","When drawn, BURN (15 P/T) two random cards in your opponent's hand until played. When played with Tutankhamun, give that card +50 Power this turn.","NULL"
"791","EMM017","Carlota of Mexico","1","Cmmn","Unruly Rulers","6","130","When played, give all your cards -50 Power this turn.","NULL"
"792","EMM012","Emperor Norton I","1","Cmmn","Unruly Rulers","7","54","When drawn, give all your opponent's cards -5 Power and give this card +35 Power this turn.","NULL"
"793","EMM008","Qin Shi Huang","1","Lgnd","Unruly Rulers","3","35","When returned to your deck, BURN (20 P/T) all cards for the rest of the round. If you won the turn, BURN your opponent's cards again.","NULL"
"794","EMM020","Sultan Ibrahim","1","Epic","Unruly Rulers","3","28","When drawn, give your opponent's Cool Cats and Cute Cats -15 Power until played, and reduce the Energy cost of yours by 2 until played.","NULL"
"795","EMM021","Marie Antoinette","1","Epic","Unruly Rulers","7","74","When returned to your deck, reduce the Energy Cost of your Ultra Fusion and Mythic cards (even if they're in your deck) by 2 for the rest of the round.","NULL"
"796","EMM014","Elagabalus","1","Rare","Unruly Rulers","6","65","When returned to your deck, if you won the turn, give all cards left in both players hands -50 Power next turn.","NULL"
"797","EMM022","Charlemagne","1","Lgnd","Unruly Rulers","3","20","When drawn, if your deck contains 3 or more Unruly Rulers cards, give all your cards (even if they're in your deck) +6 Power for the rest of the game.","NULL"
"798","EMM018","Justin II","1","Cmmn","Unruly Rulers","5","43","When played, if you are losing the round, give this card and a random card in your hand +15 Power this turn.","NULL"
"799","EMM023","Queen Ranavalona I","1","Epic","Unruly Rulers","7","68","When returned to your deck, reduce the Energy cost of your Unruly Rulers cards (even if they're in your deck) by 2 for the next two turns.","NULL"
"800","EMM025","Oliver Cromwell","1","Rare","Unruly Rulers","6","58","When played, give your opponent's Arts and Culture cards -20 Power this turn (and give their Prominent Painters cards an extra -10 Power).","NULL"
"801","EMM026","Louis XIV","1","Lgnd","Unruly Rulers","5","45","When returned to your deck, if it contains 4 or more Unruly Rulers cards, give your Solar System cards in hand +30 Power, and reduce the Energy cost of The Sun (even if it's in your deck) by 2, for the rest of the game.","NULL"
"802","EMM024","Paul I of Russia","1","Rare","Unruly Rulers","3","31","When returned to your deck, if your deck contains 8 or more Arts and Culture cards, reduce the Energy cost of your Espionage cards (even if they're in your deck) by 1 until the end of the round.","NULL"
"803","EMM027","Elizabeth I","1","Epic","Unruly Rulers","8","76","When returned to your deck, if your deck contains Mary Queen of Scots, increase the Energy cost of your opponent's History cards by 3 until the end of the round. When played next to Mary Queen of Scots, give it and this card -100 Power this turn.","NULL"
"804","EMM028","Vlad the Impaler","1","Epic","Unruly Rulers","4","41","When played, if your deck contains 4 or more Horrible Halloween cards, if the card opposite this has a Base Power of 25 or more, give it -80 Power this turn. When returned to your deck, give your Horrible Halloween cards +13 Power (even if they're in your deck) until played.","NULL"
"805","EMM029","Mansa Musa","1","Epic","Unruly Rulers","3","22","When played, if your deck contains 3 or more Hidden Gems cards, give your cards +20 Power this turn. Repeat if you play this next to Gold.","NULL"
"806","EMM030","James VI & I","1","Lgnd","Unruly Rulers","8","76","When played, if your deck contains 9 or more History cards, give your Life on Land cards (even if they're in your deck) +12 Power until played (and vice versa).","NULL"
"807","EMM031","Attila the Hun","1","Lgnd","Unruly Rulers","8","79","When returned to your deck, increase the Energy cost of all Roman Empire cards (even if they're in either player's deck) by 4 and give yourself +15 Power/Turn, for 3 turns.","NULL"
"808","EMM032","Andronikos II Palaiologos","1","Epic","Unruly Rulers","7","50","When played, give your cards in hand +26 Power for 9 turns. When drawn after Round 3, give your cards (even if they're in your deck) -10 Power for the rest of the game.","NULL"
"809","EMM034","Frederick the Great","1","Lgnd","Unruly Rulers","7","60","When drawn, if your deck contains at least 8 Arts and Culture cards and at least 8 Science cards, gain +30 Power per turn for 9 turns.","NULL"
"810","EMM035","Uzziah","1","Epic","Unruly Rulers","7","42","When played, if your deck contains exactly 9 other Unruly Rules cards, give them, wherever they are, +16 Power until played","NULL"
"811","EMM036","Charles II of England","1","Rare","Unruly Rulers","4","10","When drawn, if you are winning the Round, give your Unruly Rulers +30 Power this turn.","NULL"
"812","OBI002","Chinstrap Penguin","0","Cmmn","Sea Birds","5","46","When played with Yellow-eyed Penguin, give that card +20 Power.","{'Effects': [{'TriggerTime': 'PLAY','Target':{'Who':'SELF','Where':'CARDS_IN_HAND','What':'NAME','CompareTo':'Yellow-eyed Penguin'},'Effect':{'Type':'POWER','Value':'+20'},'Duration':'END_TURN','Conditions':[{'Type':'PLAYED_WITH','Params':{'Who':'SELF','What':'NAME','CompareTo':'Yellow-eyed Penguin'}}]}]}"
"813","OBI011","Blue-footed Booby","0","Rare","Sea Birds","7","40","When played, your Oceans and Seas cards have +5 Power this turn and next.","NULL"
"814","OBI006","Albatross","0","Epic","Sea Birds","5","40","When played, your Opponent's cards have -10 Power for this turn and next turn.","NULL"
"815","OBI010","Pacific Gull","0","Cmmn","Sea Birds","5","45","NULL","NULL"
"816","OBI003","Sooty Terns","0","Cmmn","Sea Birds","4","34","NULL","NULL"
"817","OBI004","Puffin","1","Rare","Sea Birds","5","39","When played, your Oceans and Seas cards have +10 Power this turn.","NULL"
"818","OBI005","Brown Pelican","0","Cmmn","Sea Birds","6","51","NULL","NULL"
"819","OBI008","Macaroni Penguin","0","Cmmn","Sea Birds","2","18","When played with Yellow-Eyed Penguin, give that card +20 Power.","NULL"
"820","OBI009","Ring-billed Gull","0","Cmmn","Sea Birds","3","28","When played with Saturn, give that card +15 Power. ","{'Effects': [{'TriggerTime': 'PLAY','Target':{'Who':'SELF','Where':'CARDS_IN_HAND','What':'NAME','CompareTo':'Saturn'},'Effect':{'Type':'POWER','Value':'+15'},'Duration':'END_TURN','Conditions':[{'Type':'PLAYED_WITH','Params':{'Who':'SELF','What':'NAME','CompareTo':'Saturn'}}]}]}"
"821","OBI007","Gannets","1","Rare","Sea Birds","3","0","When played, your Sea Birds cards have +20 Power this turn.","NULL"
"822","OBI015","Frigatebird","0","Cmmn","Sea Birds","7","62","NULL","NULL"
"823","OBI013","Tropicbird","1","Lgnd","Sea Birds","6","40","When drawn, your Forces of Nature cards cost 4 less Energy until played.","NULL"
"824","OBI001","Cormorant","0","Cmmn","Sea Birds","1","9","When returned to your deck, gain +9 Power next turn.","NULL"
"825","OBI014","Yellow-eyed Penguin","0","Epic","Sea Birds","2","12","When played, your Sea Birds cards have +20 Power this turn.","NULL"
"826","OBI012","Royal Penguin","0","Fusn","Sea Birds","5","57","When played, your Unruly Rulers have +50 Power this turn.","NULL"
"827","OBI017","Rockhopper Penguin","0","Rare","Sea Birds","7","40","When returned to your deck, you have +40 Power next turn.","NULL"
"828","OBI019","Crested Auklet","0","Epic","Sea Birds","6","59","When played, your Science cards with less than 20 Base Power have +30 Power this turn.","NULL"
"829","OBI016","Wilson""s Storm Petrel","0","Cmmn","Sea Birds","3","26","When drawn, give your Forces of Nature cards +25 Power until played.","NULL"
"830","OBI018","Black Guillemot","0","Cmmn","Sea Birds","4","37","When played with Volcanic Eruption, give it +50 Power.","NULL"
"831","OBI020","Parasitic Jaeger","0","Lgnd","Sea Birds","5","60","When returned to your deck, if you lost this turn, your Opponent has -30 Power per turn for the rest of the Round.","NULL"
"832","OBI021","Great White Pelican","1","Epic","Sea Birds","2","14","When drawn, gain +2 Energy. When returned to your deck, reduce the Energy cost of Brown Pelican and Pelecanimimus (even if they're in your deck) by 4 until played.","NULL"
"833","OBI023","Horned Puffin","1","Rare","Sea Birds","3","28","When returned to your deck, give your opponent -1 Energy/turn for the rest of the round.","NULL"
"834","OBI022","King Penguin","1","Epic","Sea Birds","5","54","When drawn, played and returned to your deck, give your Common and Rare Sea Birds cards (even if they're in your deck) +5 Power until played.","NULL"
"835","OBI024","Tufted Puffin","0","Rare","Sea Birds","3","28","When played, if played opposite a Feisty Fish or Fabulous Fish card, give it -60 Power this turn.","NULL"
"836","OBI025","Mandarin Duck","1","Rare","Sea Birds","5","49","When drawn, give your Common, Rare  and Epic Chinese Folklore cards (even if they're in your deck) +14 Power until played","NULL"
"837","OBI026","Gentoo Penguin","1","Epic","Sea Birds","2","45","While in your hand, at the start of your turn, give this card -5 Power until played. ","NULL"
"838","OBI027","Antarctic Shag","0","Rare","Sea Birds","3","33","When drawn, if it is Turn 1, give this card +17 Power for the rest of the game.","NULL"
"839","OBI028","Adélie Penguin","1","Lgnd","Sea Birds","8","100","When played, give your Sea Birds cards +15 Power permanently. If you lose the turn, give this card -100 Power permanently.","NULL"
"840","ORE015","Olive Ridley Sea Turtle","1","Rare","Ocean Reptiles","3","15","When played, your Ocean Reptiles cards have +20 Power this turn.","NULL"
"841","ORE007","Galapagos Marine Iguana","1","Cmmn","Ocean Reptiles","2","17","When played, your Birds cards have +15 Power.","NULL"
"842","ORE006","Banded Sea Krait","1","Rare","Ocean Reptiles","6","55","When played with Bushmaster, give that card +30 Power.","{'Effects': [{'TriggerTime': 'PLAY','Target':{'Who':'SELF','Where':'CARDS_IN_HAND','What':'NAME','CompareTo':'Bushmaster'},'Effect':{'Type':'POWER','Value':'+30'},'Duration':'END_TURN','Conditions':[{'Type':'PLAYED_WITH','Params':{'Who':'SELF','What':'NAME','CompareTo':'Bushmaster'}}]}]}"
"843","ORE010","Saltwater Crocodile","1","Cmmn","Ocean Reptiles","1","8","When played with Sodium, give that card +34 Power.","{'Effects': [{'TriggerTime': 'PLAY','Target':{'Who':'SELF','Where':'CARDS_IN_HAND','What':'NAME','CompareTo':'Sodium'},'Effect':{'Type':'POWER','Value':'+34'},'Duration':'END_TURN','Conditions':[{'Type':'PLAYED_WITH','Params':{'Who':'SELF','What':'NAME','CompareTo':'Sodium'}}]}]}"
"844","ORE009","Green Sea Turtle","1","Lgnd","Ocean Reptiles","8","48","When played on a matching arena, your Oceans and Seas cards have +60 Power this turn","NULL"
"845","ORE003","American Crocodile","1","Lgnd","Ocean Reptiles","3","31","When played, give your Opponent -2 Energy Per Turn for the rest of the Round.","NULL"
"846","ORE005","Yellow-bellied Sea Snake","1","Cmmn","Ocean Reptiles","5","65","When drawn, give this card -65 Power this turn.","NULL"
"847","ORE014","Hybrid Iguana","1","Cmmn","Ocean Reptiles","1","10","When played with Galapagos Marine Iguana or Galapagos Land Iguana, give them +20 Power this turn.","NULL"
"848","ORE018","Mugger Crocodile","1","Rare","Ocean Reptiles","7","59","When played, your opponent's cards with 40 or less Base Power have -20 Power this turn.","NULL"
"849","ORE002","Loggerhead Turtle","1","Epic","Ocean Reptiles","5","58","When played, give each player +2 Energy/turn for the rest of the game. Whoever wins the turn gets to keep it!","NULL"
"850","ORE001","Belcher""s Sea Snake","1","Rare","Ocean Reptiles","5","40","When returned to your deck, give your Opponent -20 Power/Turn for the rest of the Round.","NULL"
"851","ORE012","Hawksbill Turtle","1","Lgnd","Ocean Reptiles","2","19","When returned to your deck, if you lost the turn, give your Opponent's cards (even if they're in their deck) -4 Power until the end of the Game.","NULL"
"852","ORE011","Kemp""s Ridley Sea Turtle","1","Rare","Ocean Reptiles","4","34","When drawn, give your History of Heartbreak cards (even if they’re in your deck) +15 Power for the rest of this Round.","NULL"
"853","ORE013","Salvadori Monitor","1","Cmmn","Ocean Reptiles","6","53","When played on the first turn of a round, gain +12 Power/Turn until the end of the Round.","NULL"
"854","ORE016","Mud Snake","1","Epic","Ocean Reptiles","3","17","When drawn, give your opponent -20 Power/Turn until the end of the Round.","NULL"
"855","ORE017","Mangrove Monitor","1","Cmmn","Ocean Reptiles","4","55","When returned to your deck, if you lost this turn, give this card and a random card left in your hand -17 Power for the rest of the game.","NULL"
"856","ORE004","Flatback Sea Turtle","1","Cmmn","Ocean Reptiles","3","69","When returned to your deck, give this card -60 Power until played.","NULL"
"857","ORE020","Olive Sea Snake","1","Cmmn","Ocean Reptiles","3","26","When played, give this card +20 Power this turn and give yourself -15 Power/Turn for the rest of the round.","NULL"
"858","ORE019","Rainbow Snake","1","Lgnd","Ocean Reptiles","7","35","When played, if your deck contains cards from 6 or more Albums, gain +30 Power/Turn for the rest of this round.","NULL"
"859","ORE008","Leatherback Sea Turtle","1","Epic","Ocean Reptiles","4","37","When returned to your deck, reduce the Energy cost of your cards with a Base Energy of 7 or higher by 3 for the rest of the round.","NULL"
"860","ORE021","Nile Crocodile","1","Epic","Ocean Reptiles","7","35","When drawn, LOCK this card for 5 Turns. At the start of your turn, if the round is not tied, give this card +35 Power for 5 turns.","NULL"
"861","ORE023","American Alligator","1","Epic","Ocean Reptiles","4","32","When drawn, if you have Chinese Alligator in your deck, give your cards, wherever they are, +10 Power for 2 turns. ","NULL"
"862","ORE022","Chinese Alligator","1","Lgnd","Ocean Reptiles","6","42","When returned to your deck, for each Mythical Creature card you have played (up to a maximum of 9), give your Ocean Reptiles cards, wherever they are, +4 Power until played.","NULL"
"863","ORE024","Blanding""s Turtle","1","Epic","Ocean Reptiles","6","65","When drawn, for each completed round, reduce the Energy cost of this card by 1 for the rest of the round.","NULL"
"864","ODE001","Weedy Sea Dragon","0","Rare","Deep Ocean","2","18","When played, if you are losing the round, this card has +25 Power.","NULL"
"865","ODE003","Painted Frogfish","0","Cmmn","Deep Ocean","4","32","NULL","NULL"
"866","ODE005","Longnose Hawkfish","0","Cmmn","Deep Ocean","6","55","NULL","NULL"
"867","ODE007","Hairy Frogfish","0","Cmmn","Deep Ocean","5","0","When drawn, this card has +60 Power this turn.","NULL"
"868","ODE009","Fangtooth Moray","0","Epic","Deep Ocean","3","29","When drawn, give The Moon and Pizza (even if they're in your deck) +60 Power until played.","NULL"
"869","ODE010","Stingray","0","Lgnd","Deep Ocean","2","10","When played, your cards have +18 Power this turn.","NULL"
"870","ODE011","Japanese Sea Nettle","0","Cmmn","Deep Ocean","3","26","NULL","NULL"
"871","ODE012","Giant Isopod","0","Rare","Deep Ocean","8","72","When played, if you lose the turn, gain +3 Energy.","NULL"
"872","ODE013","Falco Hawkfish","0","Fusn","Deep Ocean","6","65","When played, your Sea Birds cards have +30 Power this turn.","NULL"
"873","ODE006","Napoleon Fish","1","Epic","Deep Ocean","2","0","When played, this has +50 Power if you are winning the round.","NULL"
"874","ODE020","Porpita Porpita","0","Rare","Deep Ocean","3","50","When returned to the deck, this card has -40 Power for the rest of the game.","NULL"
"875","ODE018","Sarcastic Fringehead","1","Epic","Deep Ocean","3","29","When played, give your Opponent's cards -10 Power for the rest of the round.","NULL"
"876","ODE002","Red-lipped Batfish","0","Cmmn","Deep Ocean","7","63","When played alongside Valentines Specials, give them +15 Power this turn.","NULL"
"877","ODE004","Sea Cucumber","0","Cmmn","Deep Ocean","5","55","When drawn, give every card in your hand +2 Power for the rest of the game.","NULL"
"878","ODE016","Atlantic Wolffish","0","Rare","Deep Ocean","3","27","When played, give Lupus (even if it's in your deck) +20 Power until it is played.","NULL"
"879","ODE017","Anglerfish","1","Lgnd","Deep Ocean","6","62","When drawn, this card steals 30 Power from a random card in your opponent's hand for the rest of the round.","NULL"
"880","ODE015","Ghost Shark","0","Rare","Deep Ocean","6","42","When drawn, if your deck contains 4 or more Deep Ocean cards, gain +6 Power/Turn for the rest of the Game.","NULL"
"881","ODE014","Sea Spider","1","Epic","Deep Ocean","6","46","When drawn, give your Bugs and Venomous Creatures cards (even if they're in your deck) +14 Power until played. ","NULL"
"882","ODE008","Siphonophore","1","Epic","Deep Ocean","3","8","When drawn, give your Opponent's cards -4 Power, and give this card +20 Power, until played. ","NULL"
"883","ODE021","Barreleye","1","Epic","Deep Ocean","3","36","When played, give your Awesome Aviation and Birds (even if they’re in your deck) cards +17 Power until played.","NULL"
"884","ODE019","Crystal Jelly","1","Lgnd","Deep Ocean","8","82","When drawn, reduce the Energy cost of your Oceans and Seas cards (even if in your deck) by -1 until played.","NULL"
"885","ODE022","Granrojo Jellyfish","1","Epic","Deep Ocean","4","47","When played, give all cards -10 Power this turn. If you win the turn, your opponent's cards keep it until played.","NULL"
"886","ODE023","Viperfish","1","Epic","Deep Ocean","7","49","When played, give a random card in your opponent's hand -100 Power this turn and next.","NULL"
"887","ODE024","Lion""s Mane Jellyfish","1","Epic","Deep Ocean","6","58","When drawn, reduce the energy cost of all your cards with Hair in the name (even if they're in your deck) by 3 until played.","NULL"
"888","ODE025","Scaly-foot Gastropod","1","Rare","Deep Ocean","7","67","When returned to your deck, reduce the Energy cost of all of your Machines of War cards by 1 (even if they're in your deck) for the rest of the game.","NULL"
"889","ODE026","Comb Jellies","1","Rare","Deep Ocean","5","48","When played with Mary River Turtle, give that card +48 Power this turn.","NULL"
"890","ODE027","Brittle Stars","0","Rare","Deep Ocean","7","69","When drawn, give five random cards in either player's hand -6 Power until played. If your deck contains 4 or more Deep Ocean cards, repeat this on all your opponent's cards in hand.","NULL"
"891","ODE028","Whiplash Squid","1","Rare","Deep Ocean","2","20","When returned to your deck, reduce the Energy cost of your Espionage and Little Critters cards by 1 for 3 turns.","NULL"
"892","ODE029","Blob Sculpin","0","Cmmn","Deep Ocean","5","44","Give your Prominent Painters wherever they are +6 power until played.","NULL"
"893","ODE030","Pompeii Worm","1","Epic","Deep Ocean","2","18","When played, if it is the last turn of a round and you are losing by 30 points or less, give this card +90 Power.","NULL"
"894","ODE031","Cannonball Jellyfish","0","Cmmn","Deep Ocean","3","29","If your deck contains Cannon, give your Plundering Pirates +6 Power wherever they are this round.","NULL"
"895","ODE032","Marrus orthocanna","0","Lgnd","Deep Ocean","4","0","When played adjacent to two Oceans and Seas cards, give your Oceans and Seas cards, wherever they are, +16 Power for the rest of the round.","NULL"
"896","OCE001","Red-spotted Box Crab","1","Cmmn","Crustaceans","3","28","When drawn, if you are losing the round, this card costs 2 less Energy this turn.","NULL"
"897","OCE002","Emperor Shrimp","1","Rare","Crustaceans","4","64","When returned to your deck, your Opponent gains +1 Energy.","NULL"
"898","OCE003","Ecuadorian Hermit Crab","1","Cmmn","Crustaceans","7","62","NULL","NULL"
"899","OCE004","Horned Ghost Crab","1","Cmmn","Crustaceans","1","9","NULL","NULL"
"900","OCE005","Spiny Lobster","1","Cmmn","Crustaceans","2","19","NULL","NULL"
"901","OCE006","Porcelain Crab","1","Cmmn","Crustaceans","8","69","When played on a matching Arena, this card has +20 Power.","NULL"
"902","OCE007","Japanese Spider Crab","1","Lgnd","Crustaceans","3","37","When drawn, steal 1 Energy from your opponent.","NULL"
"903","OCE017","Coconut Crab","1","Epic","Crustaceans","5","100","When returned to your deck, this card has 40 Power less for the rest of the game.","NULL"
"904","OCE009","Mantis Shrimp","1","Epic","Crustaceans","6","51","When played on a matching Arena, BURN (15 P/T) your Opponent's cards until the end of the round.","NULL"
"905","OCE010","Barnacles","1","Cmmn","Crustaceans","2","18","When played, your Opponent's Riding The Waves! cards (even if they are in the deck) have -18 Power for the rest of the game.","NULL"
"906","OCE011","Snapping Shrimp","1","Cmmn","Crustaceans","4","37","When played with Alligator Snapping Turtle, give that card +65 Power.","{'Effects': [{'TriggerTime': 'PLAY','Target':{'Who':'SELF','Where':'CARDS_IN_HAND','What':'NAME','CompareTo':'Alligator Snapping Turtle'},'Effect':{'Type':'POWER','Value':'+65'},'Duration':'END_TURN','Conditions':[{'Type':'PLAYED_WITH','Params':{'Who':'SELF','What':'NAME','CompareTo':'Alligator Snapping Turtle'}}]}]}"
"907","OCE014","Red Swamp Crawfish","1","Rare","Crustaceans","3","28","When drawn, if you are losing the round, this card has +25 Power until played.","NULL"
"908","OCE019","Arrowhead Crab","1","Epic","Crustaceans","4","84","When returned to your deck, give this card -60 Power until it is played.","NULL"
"909","OCE013","Halloween Crab","1","Lgnd","Crustaceans","7","69","When returned to your deck, if you won this turn, gain +30 Power next turn and reduce the cost of this card by 2 for the rest of the game.","NULL"
"910","OCE015","Giant Acorn Barnacle","1","Epic","Crustaceans","5","70","When drawn, give this card and a random card in your opponent's hand -30 Power until played. When played with Barnacles, give it +50 Power this turn.","NULL"
"911","OCE020","Candy Crab","1","Lgnd","Crustaceans","4","100","When returned to your deck, increase the energy cost of this card by 6 for the rest of the game.","NULL"
"912","OCE021","Remipedes","1","Rare","Crustaceans","2","0","When returned to your deck, lose 1 Energy/Turn and gain +35 Power/Turn for the rest of the round.","NULL"
"913","OCE016","Gribbles","1","Epic","Crustaceans","2","17","When drawn, reduce the Energy cost of your Tremendous Trees cards (even if they're in your deck) by 2 until played.","NULL"
"914","OCE018","Boxer Crab","1","Rare","Crustaceans","5","52","When drawn, reduce the Energy cost of your Oceans and Seas cards (even if in your deck) by 1 for the rest of this round.","NULL"
"915","OCE012","Jaguar Round Crab","1","Rare","Crustaceans","2","29","When returned to your deck, give a random card left in your hand +29 Power until played and give this card -29 Power until played.","NULL"
"916","OCE008","Krill","1","Epic","Crustaceans","1","8","When played, give your Oceans and Seas cards (even if they're in your deck) +10 power until the end of the round.","NULL"
"917","OCE022","Crystal Red Shrimp","1","Lgnd","Crustaceans","7","47","When returned to your deck, give all your Oceans and Seas and Life on Land cards (even if they're in your deck) +19 Power for the rest of this round.","NULL"
"918","OCE023","Harlequin Crab","1","Rare","Crustaceans","3","28","When played, if your deck contains 5 or more Crustaceans cards, give this card +40 Power this turn.","NULL"
"919","OCE025","Orangutan Crab","1","Rare","Crustaceans","6","46","When drawn, steal 15 Power from three random cards in either player's hand for the rest of the round. When returned to your deck, reduce the Energy cost of this card by 1 for the rest of the game.","NULL"
"920","OCE024","Blue Crayfish","1","Lgnd","Crustaceans","5","24","When played, if you have played Sapphire this game, give your Crustaceans cards (even if they're in your deck) +26 Power until played.","NULL"
"921","OCE026","Warty Crab","1","Cmmn","Crustaceans","6","57","When played, if you have played Oliver Cromwell this game, give it and Warthog (even if they're in your deck) +32 Power until played.","NULL"
"922","LPL001","Petunia","0","Lvl Lgnd","Plant Life","4","42","When played with Sperm Whale, give that card +70 Power.","{'Effects': [{'TriggerTime': 'PLAY','Target':{'Who':'SELF','Where':'CARDS_IN_HAND','What':'NAME','CompareTo':'Sperm Whale'},'Effect':{'Type':'POWER','Value':'+70'},'Duration':'END_TURN','Conditions':[{'Type':'PLAYED_WITH','Params':{'Who':'SELF','What':'NAME','CompareTo':'Sperm Whale'}}]}]}"
