"Id","IdString","Name","Lim","Rarity","Collection","Energy","Power","EffectDescription","EffectJSON"
"1520","POM004","Gigantoraptor","0","Lgnd","Omnivores","2","28","When played, if you won the turn, this card gains +30 Power for the rest of the game.","NULL"
"1521","POM008","Heterodontosaurus","0","Rare","Omnivores","1","6","When played, give your Sharks! cards +12 Power until they are played.","NULL"
"1522","POM017","Hypsilophodon","0","Cmmn","Omnivores","3","24","When played, give your Pioneers of Science cards +20 Power this turn.","NULL"
"1523","POM018","Balaur bondoc","0","Epic","Omnivores","7","72","When drawn, BURN (30 P/T) a random card in your opponent's hand until it is played.","NULL"
"1524","POM019","Plateosaurus","0","Rare","Omnivores","6","27","When played, your cards have +30 Power and your Opponent's have +15 Power, this turn.","NULL"
"1525","POM016","Struthiomimus","0","Rare","Omnivores","2","16","When played, your Birds have +15 Power this turn.","NULL"
"1526","POM020","Anchisaurus","1","Epic","Omnivores","4","35","When returned to your deck, if you lost this turn, you have +35 Power and your Paleontology cards (even if they're in your deck) have +10 Power next turn.","NULL"
"1527","POM021","Mononykus","0","Epic","Omnivores","3","13","When played, your Omnivores cards have +17 Power this turn.","NULL"
"1528","POM022","Dracorex","1","Rare","Omnivores","6","41","When drawn, if your deck contains 8 or more Paleontology cards, reduce the Energy cost of your Paleontology cards by -1 until the end of the Round.","NULL"
"1529","POM023","Microvenator","0","Rare","Omnivores","3","36","When played, give Teeth and Deinonychus (even if they're in your deck) +24 Power until played.","NULL"
"1530","LHY004","Zorse","0","Rare","Hybrid Animals","5","55","When played with Bengal Cat, give it +30 Power this turn.","NULL"
"1531","LHY002","Bengal Cat","0","Rare","Hybrid Animals","2","17","When played with Mule, give it +30 Power this turn.","NULL"
"1532","LHY003","Mule","0","Rare","Hybrid Animals","7","63","When played with Zorse, give it +30 Power this turn.","NULL"
"1533","LHY001","Liger","0","Fusn","Hybrid Animals","3","0","When played, give your Hybrid Animals cards (even if they're in your deck) +30 Power until played.","NULL"
"1534","LHY005","Żubroń","0","Rare","Hybrid Animals","4","42","When returned to your deck, if you are winning the round, gain +1 Energy/Turn for the rest of the round. ","NULL"
"1535","LHY006","Beefalo","1","Epic","Hybrid Animals","6","58","When played, give your Opponent's Life on Land cards -30 Power until the end of the round.","NULL"
"1536","ACNO001","Loki","1","Lgnd","Norse Mythology","5","35","When returned to your deck, your Opponent's cards left in hand cost 3 more Energy next turn.","{'Effects': [{'TriggerTime': 'RETURN','Target':{'Who':'OPPONENT','Where':'CARDS_REMAINING'},'Effect':{'Type':'ENERGY','Value':'+3'},'Duration':{'Type':'TIMER','Params':{'Value':'1'}}}]}"
"1537","ACNO002","Freya","1","Cmmn","Norse Mythology","2","25","When played, all cards have -25 Power this turn.","{'Effects': [{'TriggerTime': 'PLAY','Target':{'Who':'BOTH','Where':'CARDS_IN_HAND'},'Effect':{'Type':'POWER','Value':'-25'},'Duration':'END_TURN'}]}"
"1538","ACNO003","Thor","1","Lgnd","Norse Mythology","5","48","When played, Thunderstorms cards gain +30 Power until played.","{'Effects': [{'TriggerTime': 'PLAY','Target':{'Who':'SELF','Where':'CARDS_IN_DECK','What':'NAME','CompareTo':'Thunderstorms'},'Effect':{'Type':'POWER','Value':'+30'},'Duration':'UNTIL_PLAYED'}]}"
"1539","ACNO005","Freyr","1","Rare","Norse Mythology","3","33","When returned to your deck, both players gain +3 Energy.","NULL"
"1540","ACNO006","Baldr","1","Cmmn","Norse Mythology","4","32","When returned to your deck, if you won the turn,  gain +40 Power next turn.","NULL"
"1541","ACNO007","Frigga","1","Epic","Norse Mythology","7","70","When played with Odin, give that card +70 Power.","{'Effects': [{'TriggerTime': 'PLAY','Target':{'Who':'SELF','Where':'CARDS_IN_HAND','What':'NAME','CompareTo':'Odin'},'Effect':{'Type':'POWER','Value':'+70'},'Duration':'END_TURN','Conditions':[{'Type':'PLAYED_WITH','Params':{'Who':'SELF','What':'NAME','CompareTo':'Odin'}}]}]}"
"1542","ACNO008","Tyr","1","Cmmn","Norse Mythology","9","75","When drawn, your Norse Mythology cards have +25 Power until played.","NULL"
"1543","ACNO004","Odin","1","Epic","Norse Mythology","3","30","When played with Frigga, give that card +30 Power.","{'Effects': [{'TriggerTime': 'PLAY','Target':{'Who':'SELF','Where':'CARDS_IN_HAND','What':'NAME','CompareTo':'Frigga'},'Effect':{'Type':'POWER','Value':'+30'},'Duration':'END_TURN','Conditions':[{'Type':'PLAYED_WITH','Params':{'Who':'SELF','What':'NAME','CompareTo':'Frigga'}}]}]}"
"1544","ACNO009","Mjölnir","1","Epic","Norse Mythology","4","44","When played with Thor, give it +68 Power this turn.","NULL"
"1545","ACNO011","Ymir","1","Rare","Norse Mythology","9","87","When drawn, Lock a random card in your opponent's hand for this turn. If you are losing the round, also give it -20 Power until it is played.","{'Effects': [{'TriggerTime': 'DRAW','Target':{'Who':'OTHER','Where':'CARDS_IN_HAND','What':'RANDOM'},'Effect':{'Type':'LOCK'},'Duration':'END_TURN',},{'TriggerTime': 'DRAW','Target':{'Who':'OTHER','Where':'CARDS_IN_HAND','What':'RANDOM'},'Effect':{'Type':'POWER','Value':'-20'},'Duration':'UNTIL_PLAYED','Conditions':[{'Type':'ROUND_STATE','Params':{'Value':'Loosing'}}]}]}"
"1546","ACNO010","Fenrir","1","Rare","Norse Mythology","3","26","When played with Atlantic Wolffish or Lupus, give them +24 Power this turn.","NULL"
"1547","ACNO014","Asgard","1","Epic","Norse Mythology","7","46","When drawn, reduce the Energy cost of your Norse Mythology cards in hand by 2 until played. If you are winning the round, reduce them by 1 more. When played with Midgard, give it +20 Power this turn.","NULL"
"1548","ACNO017","Midgard","1","Cmmn","Norse Mythology","1","11","When played with Helheim, give it +20 Power this turn.","NULL"
"1549","ACNO020","Helheim","1","Cmmn","Norse Mythology","2","19","When played with Asgard, give it +20 Power this turn.","NULL"
"1550","ACNO012","Heimdall","1","Lgnd","Norse Mythology","6","30","When returned to your deck, if it contains cards from 6 or more Albums, give your cards (even if they're in your deck) +30 Power this round.","NULL"
"1551","ACNO015","Valkyrie","1","Cmmn","Norse Mythology","7","65","When drawn, if you are losing the round, reduce the Energy cost of your cards in hand by 1 for the rest of the round.","NULL"
"1552","ACNO018","Surtr","1","Epic","Norse Mythology","6","50","When drawn, give your cards +10 Power this turn. If you are losing the round, give them an extra 10 for the rest of the round.","NULL"
"1553","ACNO013","Valhalla","1","Cmmn","Norse Mythology","3","20","When returned to your deck, if you lost this turn, gain +35 Power/Turn next turn.","NULL"
"1554","ACNO016","Ragnarök","1","Lgnd","Norse Mythology","4","48","When drawn, increase the Energy cost of your opponent's cards by 2 this turn.","NULL"
"1555","ACNO021","Berserkers","1","Cmmn","Norse Mythology","3","47","When played, give this card -12 Power this turn. When returned to your deck, give it +26 Power for the rest of the game.","NULL"
"1556","ACNO019","Sleipnir","1","Rare","Norse Mythology","3","28","When drawn or played, give Odin +70 Power until played.","NULL"
"1557","ACNO023","Gjallarhorn","1","Lgnd","Norse Mythology","2","23","When drawn, give a random Norse Mythology card in your hand +25 Power until played. When played, give Heimdall (even if it's in your deck) +30 Power until played.","NULL"
"1558","ACNO022","Laufey","1","Epic","Norse Mythology","2","17","When played, give Loki and your Common and Rare cards +25 Power this turn.","NULL"
"1559","ACNO024","Mead of Poetry","1","Epic","Norse Mythology","3","25","When played, give your The Write Stuff cards +60 power this turn. When returned to your deck, your The Write Stuff cards lose -10 power for the rest of the game.","NULL"
"1560","ACNO027","Skaði","1","Rare","Norse Mythology","3","29","When played, give your Natural Monuments cards in hand +26 Power this turn and next","NULL"
"1561","ACNO028","Hel","1","Lgnd","Norse Mythology","3","31","When played, if you have lost 2 Rounds of this game, give your cards +55 Power this turn.","NULL"
"1562","ACNO025","Sol and Mani","1","Rare","Norse Mythology","2","22","When returned to your deck, reduce the Energy cost of The Sun and The Moon (even if they're in your deck) by 3 until played.","NULL"
"1563","ACNO026","Auðumbla","1","Cmmn","Norse Mythology","6","58","At the start of every turn, while in hand, give your Ymir card in hand +22 Power for 3 turns.","NULL"
"1564","ACNO029","Draugr","1","Rare","Norse Mythology","3","27","When returned to your deck, if you lost this turn, give your Norse Mythology and Machines of War cards (even if they're in your deck) +10 Power until played.","NULL"
"1565","ACNO030","Tanngrisnir and Tanngnjóstr","1","Rare","Norse Mythology","2","19","When drawn, if your deck contains Teeth, reduce the Energy cost of a random Paleontology card and a random Sharks! card in your hand by 2 until played.","NULL"
"1566","ACNO033","Huginn and Muninn","1","Epic","Norse Mythology","4","30","When drawn, this card steals +5 Power from each of your Opponent’s cards and keeps it for 6 turns.","NULL"
"1567","ACNO031","Vili and Vé","1","Lgnd","Norse Mythology","9","99","When drawn, if you have played Odin this game, give it (even if it's in your deck) +33 Power until the end of the round, and give 2 random cards (in either player's hand) +33 Power until the end of the round.","NULL"
"1568","ACNO032","Ask and Embla","1","Cmmn","Norse Mythology","1","1","When played on the first turn of the round, give your cards +10 Power this turn.","NULL"
"1569","ACNO034","Geri and Freki","1","Epic","Norse Mythology","5","92","When played, give all adjacent and opposite cards -30 Power this turn.","NULL"
"1570","ACNO035","Fimbulwinter","1","Epic","Norse Mythology","7","67","When played, if your deck contains 2 or more Ice Age cards, give your Norse Mythology cards (even if they're in your deck) +12 Power until played.","NULL"
"1571","ACNO036","Fylgja","1","Cmmn","Norse Mythology","3","25","When returned to your deck, give a random card in your hand +25 Power until played and increase the Energy cost of a random card in your hand by 3 until played.","NULL"
"1572","ACNO037","Brísingamen","1","Rare","Norse Mythology","2","25","When drawn, give Freya (even if it's in your deck) +40 Power until played.","NULL"
"1573","ACNO041","Skuld","1","Cmmn","Norse Mythology","6","57","When drawn, if you have played Urðarbrunnr, give Urðr and Verðandi (wherever they are) +20 Power until played.","NULL"
"1574","ACNO039","Urðr","1","Epic","Norse Mythology","4","35","When returned to your deck, if you have played Urðarbrunnr, give Verðandi and Skuld (wherever they are) +60 Power until played.","NULL"
"1575","ACNO040","Verðandi","1","Rare","Norse Mythology","5","46","When played, if you have played Urðarbrunnr, give Urðr and Skuld (wherever they are) +40 Power until played.","{'Effects': [{'TriggerTime': 'PLAY','Target':{'Who':'SELF','Where':'CARDS_IN_DECK','What':'NAME','CompareTo':'Urðr'},'Effect':{'Type':'POWER','Value':'+40'},'Duration':'UNTIL_PLAYED','Conditions':[{'Type':'PLAYED_BEFORE','Params':{'Who':'SELF','What':'NAME','CompareTo':'Urðarbrunnr'}}]},{'TriggerTime': 'PLAY','Target':{'Who':'SELF','Where':'CARDS_IN_DECK','What':'NAME','CompareTo':'Skuld'},'Effect':{'Type':'POWER','Value':'+40'},'Duration':'UNTIL_PLAYED','Conditions':[{'Type':'PLAYED_BEFORE','Params':{'Who':'SELF','What':'NAME','CompareTo':'Urðarbrunnr'}}]}]}"
"1576","ACNO038","Urðarbrunnr","1","Lgnd","Norse Mythology","5","0","When played, if you have played Urðr, Verðandi and Skuld, give this card +120 Power.","NULL"
"1577","ACNO042","Ratatoskr","1","Rare","Norse Mythology","3","25","When drawn, give your Norse Mythology cards +15 Power until played.nWhen returned to your deck, give your Norse Mythology cards -5 Power until played.","NULL"
"1578","PFF001","Ornithocheirus","1","Cmmn","Fearsome Flyers","2","19","NULL","NULL"
"1579","PFF002","Anhanguera","1","Cmmn","Fearsome Flyers","4","30","When drawn, gain +1 Energy.","NULL"
"1580","PFF005","Thalassodromeus","1","Cmmn","Fearsome Flyers","4","39","NULL","NULL"
"1581","PFF006","Dorygnathus","1","Cmmn","Fearsome Flyers","5","41","NULL","NULL"
"1582","PFF007","Quetzalcoatlus","1","Rare","Fearsome Flyers","7","52","When played with Bushmaster, give that card +50 Power.","{'Effects': [{'TriggerTime': 'PLAY','Target':{'Who':'SELF','Where':'CARDS_IN_HAND','What':'NAME','CompareTo':'Bushmaster'},'Effect':{'Type':'POWER','Value':'+50'},'Duration':'END_TURN','Conditions':[{'Type':'PLAYED_WITH','Params':{'Who':'SELF','What':'NAME','CompareTo':'Bushmaster'}}]}]}"
"1583","PFF012","Pterodactylus","1","Lgnd","Fearsome Flyers","4","27","When returned to your deck, your cards have +15 Power until played.","NULL"
"1584","PFF014","Rhamphorhynchus","1","Cmmn","Fearsome Flyers","3","10","When returned to your deck, your Paleontology cards have +10 Power until played.","NULL"
"1585","PFF004","Pteranodon","1","Lgnd","Fearsome Flyers","4","31","When played, if you win the turn, gain 6 Energy.","NULL"
"1586","PFF003","Eudimorphodon","1","Cmmn","Fearsome Flyers","3","29","When played, all Oceans and Seas cards have -15 Power this turn.","{'Effects': [{'TriggerTime': 'PLAY','Target':{'Who':'BOTH','Where':'CARDS_IN_DECK','What':'ALBUM','CompareTo':'Oceans and Seas'},'Effect':{'Type':'POWER','Value':'-15'},'Duration':'END_TURN',}]}"
"1587","PFF008","Microraptor","1","Cmmn","Fearsome Flyers","5","47","When played, your Birds cards have +15 Power this turn.","NULL"
"1588","PFF009","Dimorphodon","1","Epic","Fearsome Flyers","3","27","When played, your Carnivores cards have +25 power this turn.","NULL"
"1589","PFF010","Tupuxuara","1","Cmmn","Fearsome Flyers","4","35","When played with Parasauralophus, give that card +30 Power.","NULL"
"1590","PFF013","Cryodrakon","1","Epic","Fearsome Flyers","5","55","When played on a matching Arena, this has +55 Power.","NULL"
"1591","PFF017","Hatzegopteryx","1","Lgnd","Fearsome Flyers","5","44","When played, give all cards in your hand +30 Power until played if you lost the turn.","NULL"
"1592","PFF015","Dsungaripterus","1","Cmmn","Fearsome Flyers","2","40","When drawn, give this card -15 Power for the rest of the game.","NULL"
"1593","PFF019","Zhejiangopterus","1","Epic","Fearsome Flyers","6","42","When returned to your deck, reduce the Energy cost of your Fearsome Flyers (even if they're in your deck) by 1 until they are played. If you are winning the round, reduce them by another 1.","NULL"
"1594","PFF011","Tapejara","1","Cmmn","Fearsome Flyers","3","10","When played, your Fearsome Flyers have +20 Power this turn.","NULL"
"1595","PFF016","Peteinosaurus","1","Rare","Fearsome Flyers","2","17","When played with Thick-headed Fly give it +20 Power. When returned to your deck, gain +1 Energy per turn for the rest of the round.","NULL"
"1596","PFF018","Anchiornis","1","Rare","Fearsome Flyers","2","22","When played with Anchisaurus, give it +36 Power.","NULL"
"1597","PFF020","Zhenyuanopterus","1","Rare","Fearsome Flyers","9","65","When returned to your deck, if you lost this turn, gain +65 Power next turn.","NULL"
"1598","PFF021","Pterodaustro","1","Epic","Fearsome Flyers","3","32","When drawn, give Flamingos (even if it's in your deck) +46 Power for the rest of the Game. ","NULL"
"1599","PFF022","Yi Qi","1","Epic","Fearsome Flyers","7","65","When drawn, increase the cost of 2 random cards in your hand by 3 and give two random cards in your hand +40 Power until the end of the round.","NULL"
"1600","PFF023","Confuciusornis","1","Lgnd","Fearsome Flyers","5","51","When returned to your deck, give your Philosophy cards (even if they're in your deck) +18 Power until played. If you have played Confucius this game, give them an additional 16 Power. ","NULL"
"1601","PFF024","Sharovipteryx","1","Rare","Fearsome Flyers","4","39","When drawn, reduce the Energy cost of your Tennis card (even if it's in your deck) by 1 for the rest of the game.","NULL"
"1602","PFF025","Jeholornis","1","Rare","Fearsome Flyers","7","63","When drawn, if you are losing the round, reduce the Energy cost of this card by 5 until played.","NULL"
"1603","PFF026","Haast""s Eagle","1","Epic","Fearsome Flyers","8","76","When returned to your deck, if you won this turn and have won 1 round this game, gain +5 Energy/Turn for three turns.","NULL"
"1604","PFF027","Caihong Juji","1","Lgnd","Fearsome Flyers","5","52","When drawn, if your deck contains at least 3 cards from Paleontology, Life on Land or Science, give your Unruly Rulers cards (even if they're in your deck) +20 Power for two turns.","NULL"
"1605","PFF028","Changyuraptor","1","Lgnd","Fearsome Flyers","5","64","When played, give your Birds cards in hand +10 Power for the rest of the game.","NULL"
"1606","EOW002","Billy the Kid","0","Cmmn","Legends of the Old West","8","66","While this card is in your hand, you have +10 Power/Turn.","NULL"
"1607","EOW005","Annie Oakley","0","Epic","Legends of the Old West","8","71","When drawn, your Legends of the Old West cards cost 2 less Energy until played.","NULL"
"1608","EOW006","Jesse James","0","Cmmn","Legends of the Old West","7","62","NULL","NULL"
"1609","EOW010","Elmer McCurdy","0","Cmmn","Legends of the Old West","3","24","NULL","NULL"
"1610","EOW014","Butch Cassidy","0","Rare","Legends of the Old West","4","5","When played, your Legends of the Old West cards have +25 Power this turn.","NULL"
"1611","EOW015","Wild Bill Hickok","0","Fusn","Legends of the Old West","4","49","When played with Playing Cards, give that card +50 Power.","{'Effects': [{'TriggerTime': 'PLAY','Target':{'Who':'SELF','Where':'CARDS_IN_HAND','What':'NAME','CompareTo':'Playing Cards'},'Effect':{'Type':'POWER','Value':'+50'},'Duration':'END_TURN','Conditions':[{'Type':'PLAYED_WITH','Params':{'Who':'SELF','What':'NAME','CompareTo':'Playing Cards'}}]}]}"
"1612","EOW003","Calamity Jane","0","Cmmn","Legends of the Old West","5","92","When played, your cards have -40 Power this turn.","NULL"
"1613","EOW007","Doc Holliday","0","Cmmn","Legends of the Old West","6","52","When played with Wyatt Earp, give it +25 Power.","NULL"
"1614","EOW009","Pearl Hart","0","Cmmn","Legends of the Old West","4","35","NULL","NULL"
"1615","EOW011","Sitting Bull","0","Lgnd","Legends of the Old West","4","30","When played, if you lose the turn, cards left in your hand have +25 Power next turn.","NULL"
"1616","EOW012","Wyatt Earp","0","Cmmn","Legends of the Old West","3","26","When played with Doc Holliday, give it +25 Power.","NULL"
"1617","EOW004","Goyahkla","0","Rare","Legends of the Old West","3","29","When drawn, this card costs 1 less Energy this turn.","NULL"
"1618","EOW013","Mary Fields","0","Epic","Legends of the Old West","6","50","When returned to your deck, give Paper (even if it's in your deck) +30 Power for the rest of the game.","NULL"
"1619","EOW008","Joaquin Murrieta","0","Cmmn","Legends of the Old West","8","79","When returned to your deck, if you are losing the round, steal 2 Energy from your Opponent.","NULL"
"1620","EOW016","Allan Pinkerton","0","Rare","Legends of the Old West","6","58","When returned to your deck, reduce the Energy cost of your Espionage cards by 2 until they are played.","NULL"
"1621","EOW017","Buffalo Bill","1","Lgnd","Legends of the Old West","3","19","When drawn, give your Legends of the Old West +12 Power this turn. If you are losing the round, give them an extra +25 Power.","NULL"
"1622","EOW019","1849 Gold Rush","0","Lgnd","Legends of the Old West","4","49","When played, give Gold (even if it's in your deck) +30 Power until played and when returned to deck give all of your Raging Rivers cards (even if they're in deck) +7 Power for the rest of the game.","NULL"
"1623","EOW018","Winchester Rifle","0","Epic","Legends of the Old West","5","20","When returned to your deck, gain +10 Power per Turn for the rest of the game","NULL"
"1624","EOW020","The Alamo","1","Epic","Legends of the Old West","5","34","When drawn, reduce the Energy cost of your Legends of the Old West cards (even if they're in your deck) by 1 until played.","NULL"
"1625","EOW001","Sacagawea","0","Rare","Legends of the Old West","4","31","When returned to your deck, if you are losing the round, give your Shake Up the System cards (even if they're in your deck) +25 Power until played.","NULL"
"1626","EOW021","Unsinkable Molly Brown","1","Epic","Legends of the Old West","2","18","When drawn, gain +10 Power/turn this round. When played with Titanic, give it +50 Power this turn. When returned to your deck, if you won the turn, give Titanic (even if it's in your deck) +35 Power until played.","NULL"
"1627","EOW022","Johnny Appleseed","1","Rare","Legends of the Old West","6","58","When played on the first turn of a round, gain +14 Power/Turn for the rest of it.","NULL"
"1628","EOW023","O.K. Corral","1","Epic","Legends of the Old West","3","21","When played, give your Legends of the Old West  cards +15 Power this turn and give two random cards in your opponent's hand -9 Power this turn.","NULL"
"1629","EOW024","Belle Star","1","Epic","Legends of the Old West","5","50","When returned to your deck, if you won this turn, gain +12 Power/Turn for the rest of this round. If you lost, give this card +12 Power until played.","NULL"
"1630","EOW025","Harry Alonzo Longabaugh","0","Lgnd","Legends of the Old West","3","26","When played next to Butch Cassidy, give your Legends of the Old West cards (even if they're in your deck) +19 Power for 4 turns.","NULL"
"1631","EOW026","Pistol Pete","0","Lgnd","Legends of the Old West","4","8","When drawn, give your Legends of the Old West cards +35 Power this turn.","NULL"
"1632","MYSC001","The God Particle","0","Mthc","Science Mythic Cards","3","38","When played, your Excellent Elements cards have +60 Power this turn.","NULL"
"1633","MYSC002","Simulation Theory","0","Mthc","Science Mythic Cards","3","0","When drawn, reduce the Energy cost of your cards by 3 this turn. If you are winning the Round, reduce them by an extra 1.","NULL"
"1634","MYSC003","The Multiverse","0","Mthc","Science Mythic Cards","1","11","When drawn, give a random card in your hand +11 Power and a random card in your opponent's hand -11 Power for the rest of the game.nWhen played, give your cards +11 Power until played.","NULL"
"1635","MYSC004","The Theory of Everything","0","Mthc","Science Mythic Cards","5","0","When played, if your deck contains at least 1 card from 6 or more Albums, give your Science cards in hand +24 Power for the rest of the game.","NULL"
"1636","LAL001","Red Kangaroo","1","Cmmn","Marsupials","5","43","When played, if you lose the turn, steal 1 Energy from your opponent.","NULL"
"1637","LAL004","Wallaby","1","Rare","Marsupials","6","48","When played, if you lose the turn, your opponent's cards have -10 Power next turn.","NULL"
"1638","LAL005","Koala","1","Lgnd","Marsupials","4","29","When played, your Opponent's cards have -20 Power this turn.","NULL"
"1639","LAL011","Numbat","1","Cmmn","Marsupials","2","17","When drawn, your Bugs cards have -20 Power.","NULL"
"1640","LAL012","Brushtail Possum","1","Cmmn","Marsupials","2","29","NULL","NULL"
"1641","LAL013","Fat-tailed Dunnart","1","Cmmn","Marsupials","7","66","NULL","NULL"
"1642","LAL015","Tiger Quoll","1","Cmmn","Marsupials","1","8","NULL","NULL"
"1643","LAL003","Eastern Grey Kangaroo","1","Cmmn","Marsupials","5","32","When returned to your deck, gain +32 Power next turn.","NULL"
"1644","LAL010","Sugar Glider","1","Cmmn","Marsupials","3","35","When played, all cards have -10 Power this turn.","{'Effects': [{'TriggerTime': 'PLAY','Target':{'Who':'BOTH','Where':'CARDS_IN_HAND'},'Effect':{'Type':'POWER','Value':'-10'},'Duration':'END_TURN'}]}"
"1645","LAL008","Tasmanian Devil","1","Lgnd","Marsupials","5","89","When drawn, give a random card in your hand -25 Power for the rest of this round.","NULL"
"1646","LAL014","Quokka","1","Epic","Marsupials","2","17","When drawn, gain +30 Power for this turn.","NULL"
"1647","LAL007","Wombat","1","Epic","Marsupials","5","40","When returned to your deck, gain +40 Power next turn.","NULL"
"1648","LAL006","Potoroo","1","Cmmn","Marsupials","5","46","When played, this card gains +16 Power this turn if you are winning the round.","NULL"
"1649","LAL002","Pygmy Possum","1","Cmmn","Marsupials","1","10","When drawn, give your cards +5 Power this turn.","NULL"
"1650","LAL009","Virginia Opossum","1","Cmmn","Marsupials","2","19","When played, give your Marsupials (even if they're in your deck) +6 Power until they are played.","NULL"
"1651","LAL019","Bandicoot","1","Epic","Marsupials","4","28","When drawn, reduce the energy cost of your Marsupials cards (even if they're in your deck) by 1 until played. If you are losing the round, reduce them by an extra 1.","NULL"
"1652","LAL017","Waigeou cuscus","1","Lgnd","Marsupials","7","65","When played on a matching Arena, give your opponent's cards -15 Power until the end of the Round.","NULL"
"1653","LAL018","Wallaroo","1","Epic","Marsupials","1","8","When played with Wallaby and Red Kangaroo give those cards +35 Power this turn.","NULL"
"1654","LAL016","Monito del Monte","1","Rare","Marsupials","2","21","When played, give your Primates cards (even if they’re in your deck) +10 Power for the rest of this round.","NULL"
"1655","LAL020","Honey Possum","1","Rare","Marsupials","1","10","When played, give all cards +15 Power for the rest of this round.","NULL"
"1656","LAL021","Kultarr","1","Epic","Marsupials","1","0","When returned to your deck, give this card +60 Power and increase its energy cost by 1 for the rest of the game.","NULL"
